[I 2025-02-23 18:12:32,388] A new study created in memory with name: no-name-10b4cba8-321d-4368-8379-64740e0a97e7
C:\Users\Астемир\AppData\Local\Temp\ipykernel_12220\469718015.py:29: FutureWarning: suggest_loguniform has been deprecated in v3.0.0. This feature will be removed in v6.0.0. See https://github.com/optuna/optuna/releases/tag/v3.0.0. Use suggest_float(..., log=True) instead.
  lr = trial.suggest_loguniform("lr", 1e-5, 1e-2)
[I 2025-02-23 18:12:33,891] Trial 0 finished with value: 0.7863682512220327 and parameters: {'optimizer': 'AdamW', 'lr': 0.005614356184632764, 'momentum': 0.5925354478731865}. Best is trial 0 with value: 0.7863682512220327.
C:\Users\Астемир\AppData\Local\Temp\ipykernel_12220\469718015.py:29: FutureWarning: suggest_loguniform has been deprecated in v3.0.0. This feature will be removed in v6.0.0. See https://github.com/optuna/optuna/releases/tag/v3.0.0. Use suggest_float(..., log=True) instead.
  lr = trial.suggest_loguniform("lr", 1e-5, 1e-2)
[I 2025-02-23 18:12:34,705] Trial 1 finished with value: 0.6623751499828978 and parameters: {'optimizer': 'SGD', 'lr': 0.00011517699936176299, 'momentum': 0.6053467062839604}. Best is trial 0 with value: 0.7863682512220327.
C:\Users\Астемир\AppData\Local\Temp\ipykernel_12220\469718015.py:29: FutureWarning: suggest_loguniform has been deprecated in v3.0.0. This feature will be removed in v6.0.0. See https://github.com/optuna/optuna/releases/tag/v3.0.0. Use suggest_float(..., log=True) instead.
  lr = trial.suggest_loguniform("lr", 1e-5, 1e-2)
[I 2025-02-23 18:12:35,643] Trial 2 finished with value: 0.7749016854186762 and parameters: {'optimizer': 'SGD', 'lr': 0.002976908783569118, 'momentum': 0.8956999409381554}. Best is trial 0 with value: 0.7863682512220327.
C:\Users\Астемир\AppData\Local\Temp\ipykernel_12220\469718015.py:29: FutureWarning: suggest_loguniform has been deprecated in v3.0.0. This feature will be removed in v6.0.0. See https://github.com/optuna/optuna/releases/tag/v3.0.0. Use suggest_float(..., log=True) instead.
  lr = trial.suggest_loguniform("lr", 1e-5, 1e-2)
[I 2025-02-23 18:12:36,542] Trial 3 finished with value: 0.7759296225045832 and parameters: {'optimizer': 'SGD', 'lr': 0.0009329803307379089, 'momentum': 0.6322184452608818}. Best is trial 0 with value: 0.7863682512220327.
C:\Users\Астемир\AppData\Local\Temp\ipykernel_12220\469718015.py:29: FutureWarning: suggest_loguniform has been deprecated in v3.0.0. This feature will be removed in v6.0.0. See https://github.com/optuna/optuna/releases/tag/v3.0.0. Use suggest_float(..., log=True) instead.
  lr = trial.suggest_loguniform("lr", 1e-5, 1e-2)
[I 2025-02-23 18:12:37,372] Trial 4 finished with value: 0.6656164093506081 and parameters: {'optimizer': 'SGD', 'lr': 4.3503939990588886e-05, 'momentum': 0.528710469743241}. Best is trial 0 with value: 0.7863682512220327.
C:\Users\Астемир\AppData\Local\Temp\ipykernel_12220\469718015.py:29: FutureWarning: suggest_loguniform has been deprecated in v3.0.0. This feature will be removed in v6.0.0. See https://github.com/optuna/optuna/releases/tag/v3.0.0. Use suggest_float(..., log=True) instead.
  lr = trial.suggest_loguniform("lr", 1e-5, 1e-2)
[I 2025-02-23 18:12:38,246] Trial 5 finished with value: 0.7740655816621816 and parameters: {'optimizer': 'SGD', 'lr': 0.0008608246438005332, 'momentum': 0.9541545167668106}. Best is trial 0 with value: 0.7863682512220327.
C:\Users\Астемир\AppData\Local\Temp\ipykernel_12220\469718015.py:29: FutureWarning: suggest_loguniform has been deprecated in v3.0.0. This feature will be removed in v6.0.0. See https://github.com/optuna/optuna/releases/tag/v3.0.0. Use suggest_float(..., log=True) instead.
  lr = trial.suggest_loguniform("lr", 1e-5, 1e-2)
[I 2025-02-23 18:12:39,104] Trial 6 finished with value: 0.7582076613888371 and parameters: {'optimizer': 'SGD', 'lr': 0.0002968218346740371, 'momentum': 0.6666866959150495}. Best is trial 0 with value: 0.7863682512220327.
C:\Users\Астемир\AppData\Local\Temp\ipykernel_12220\469718015.py:29: FutureWarning: suggest_loguniform has been deprecated in v3.0.0. This feature will be removed in v6.0.0. See https://github.com/optuna/optuna/releases/tag/v3.0.0. Use suggest_float(..., log=True) instead.
  lr = trial.suggest_loguniform("lr", 1e-5, 1e-2)
[I 2025-02-23 18:12:40,050] Trial 7 finished with value: 0.6522152225176134 and parameters: {'optimizer': 'AdamW', 'lr': 1.2127282075863278e-05, 'momentum': 0.5537704592263232}. Best is trial 0 with value: 0.7863682512220327.
C:\Users\Астемир\AppData\Local\Temp\ipykernel_12220\469718015.py:29: FutureWarning: suggest_loguniform has been deprecated in v3.0.0. This feature will be removed in v6.0.0. See https://github.com/optuna/optuna/releases/tag/v3.0.0. Use suggest_float(..., log=True) instead.
  lr = trial.suggest_loguniform("lr", 1e-5, 1e-2)
[I 2025-02-23 18:12:40,875] Trial 8 finished with value: 0.7752220108838269 and parameters: {'optimizer': 'SGD', 'lr': 0.0019988585989342924, 'momentum': 0.8726237863492079}. Best is trial 0 with value: 0.7863682512220327.
C:\Users\Астемир\AppData\Local\Temp\ipykernel_12220\469718015.py:29: FutureWarning: suggest_loguniform has been deprecated in v3.0.0. This feature will be removed in v6.0.0. See https://github.com/optuna/optuna/releases/tag/v3.0.0. Use suggest_float(..., log=True) instead.
  lr = trial.suggest_loguniform("lr", 1e-5, 1e-2)
[I 2025-02-23 18:12:41,771] Trial 9 finished with value: 0.7496249296460312 and parameters: {'optimizer': 'SGD', 'lr': 0.00031998535588990235, 'momentum': 0.5562456327400365}. Best is trial 0 with value: 0.7863682512220327.
C:\Users\Астемир\AppData\Local\Temp\ipykernel_12220\469718015.py:29: FutureWarning: suggest_loguniform has been deprecated in v3.0.0. This feature will be removed in v6.0.0. See https://github.com/optuna/optuna/releases/tag/v3.0.0. Use suggest_float(..., log=True) instead.
  lr = trial.suggest_loguniform("lr", 1e-5, 1e-2)
[I 2025-02-23 18:12:42,748] Trial 10 finished with value: 0.7833785468806271 and parameters: {'optimizer': 'AdamW', 'lr': 0.008652659577270624, 'momentum': 0.743187312111951}. Best is trial 0 with value: 0.7863682512220327.
C:\Users\Астемир\AppData\Local\Temp\ipykernel_12220\469718015.py:29: FutureWarning: suggest_loguniform has been deprecated in v3.0.0. This feature will be removed in v6.0.0. See https://github.com/optuna/optuna/releases/tag/v3.0.0. Use suggest_float(..., log=True) instead.
  lr = trial.suggest_loguniform("lr", 1e-5, 1e-2)
[I 2025-02-23 18:12:43,693] Trial 11 finished with value: 0.7851122858388998 and parameters: {'optimizer': 'AdamW', 'lr': 0.008818066943117688, 'momentum': 0.747027088845855}. Best is trial 0 with value: 0.7863682512220327.
C:\Users\Астемир\AppData\Local\Temp\ipykernel_12220\469718015.py:29: FutureWarning: suggest_loguniform has been deprecated in v3.0.0. This feature will be removed in v6.0.0. See https://github.com/optuna/optuna/releases/tag/v3.0.0. Use suggest_float(..., log=True) instead.
  lr = trial.suggest_loguniform("lr", 1e-5, 1e-2)
[I 2025-02-23 18:12:44,928] Trial 12 finished with value: 0.787341895856219 and parameters: {'optimizer': 'AdamW', 'lr': 0.00988405256830818, 'momentum': 0.7615066519491794}. Best is trial 12 with value: 0.787341895856219.
C:\Users\Астемир\AppData\Local\Temp\ipykernel_12220\469718015.py:29: FutureWarning: suggest_loguniform has been deprecated in v3.0.0. This feature will be removed in v6.0.0. See https://github.com/optuna/optuna/releases/tag/v3.0.0. Use suggest_float(..., log=True) instead.
  lr = trial.suggest_loguniform("lr", 1e-5, 1e-2)
[I 2025-02-23 18:12:45,899] Trial 13 finished with value: 0.7776163080046982 and parameters: {'optimizer': 'AdamW', 'lr': 0.0028381293832474997, 'momentum': 0.7535118720729974}. Best is trial 12 with value: 0.787341895856219.
C:\Users\Астемир\AppData\Local\Temp\ipykernel_12220\469718015.py:29: FutureWarning: suggest_loguniform has been deprecated in v3.0.0. This feature will be removed in v6.0.0. See https://github.com/optuna/optuna/releases/tag/v3.0.0. Use suggest_float(..., log=True) instead.
  lr = trial.suggest_loguniform("lr", 1e-5, 1e-2)
[I 2025-02-23 18:12:47,105] Trial 14 finished with value: 0.7878667228895166 and parameters: {'optimizer': 'AdamW', 'lr': 0.009219849424620117, 'momentum': 0.8191514271368794}. Best is trial 14 with value: 0.7878667228895166.
C:\Users\Астемир\AppData\Local\Temp\ipykernel_12220\469718015.py:29: FutureWarning: suggest_loguniform has been deprecated in v3.0.0. This feature will be removed in v6.0.0. See https://github.com/optuna/optuna/releases/tag/v3.0.0. Use suggest_float(..., log=True) instead.
  lr = trial.suggest_loguniform("lr", 1e-5, 1e-2)
[I 2025-02-23 18:12:48,199] Trial 15 finished with value: 0.774755095799031 and parameters: {'optimizer': 'AdamW', 'lr': 0.0011776990993299836, 'momentum': 0.8117174546011835}. Best is trial 14 with value: 0.7878667228895166.
C:\Users\Астемир\AppData\Local\Temp\ipykernel_12220\469718015.py:29: FutureWarning: suggest_loguniform has been deprecated in v3.0.0. This feature will be removed in v6.0.0. See https://github.com/optuna/optuna/releases/tag/v3.0.0. Use suggest_float(..., log=True) instead.
  lr = trial.suggest_loguniform("lr", 1e-5, 1e-2)
[I 2025-02-23 18:12:49,179] Trial 16 finished with value: 0.7782316224575296 and parameters: {'optimizer': 'AdamW', 'lr': 0.00440736323587718, 'momentum': 0.8244665851145053}. Best is trial 14 with value: 0.7878667228895166.
C:\Users\Астемир\AppData\Local\Temp\ipykernel_12220\469718015.py:29: FutureWarning: suggest_loguniform has been deprecated in v3.0.0. This feature will be removed in v6.0.0. See https://github.com/optuna/optuna/releases/tag/v3.0.0. Use suggest_float(..., log=True) instead.
  lr = trial.suggest_loguniform("lr", 1e-5, 1e-2)
[I 2025-02-23 18:12:50,189] Trial 17 finished with value: 0.7725707294914788 and parameters: {'optimizer': 'AdamW', 'lr': 0.0003943504656475308, 'momentum': 0.6788715550195543}. Best is trial 14 with value: 0.7878667228895166.
C:\Users\Астемир\AppData\Local\Temp\ipykernel_12220\469718015.py:29: FutureWarning: suggest_loguniform has been deprecated in v3.0.0. This feature will be removed in v6.0.0. See https://github.com/optuna/optuna/releases/tag/v3.0.0. Use suggest_float(..., log=True) instead.
  lr = trial.suggest_loguniform("lr", 1e-5, 1e-2)
[I 2025-02-23 18:12:51,187] Trial 18 finished with value: 0.7835866679455554 and parameters: {'optimizer': 'AdamW', 'lr': 0.0089954094057279, 'momentum': 0.799760740013137}. Best is trial 14 with value: 0.7878667228895166.
C:\Users\Астемир\AppData\Local\Temp\ipykernel_12220\469718015.py:29: FutureWarning: suggest_loguniform has been deprecated in v3.0.0. This feature will be removed in v6.0.0. See https://github.com/optuna/optuna/releases/tag/v3.0.0. Use suggest_float(..., log=True) instead.
  lr = trial.suggest_loguniform("lr", 1e-5, 1e-2)
[I 2025-02-23 18:12:52,212] Trial 19 finished with value: 0.7640612925584955 and parameters: {'optimizer': 'AdamW', 'lr': 8.751940159124984e-05, 'momentum': 0.9690361239049342}. Best is trial 14 with value: 0.7878667228895166.
Лучшие параметры для df6_iid: {'optimizer': 'AdamW', 'lr': 0.009219849424620117, 'momentum': 0.8191514271368794}
