[I 2025-02-26 11:45:19,512] A new study created in memory with name: no-name-c8f03c98-42c5-4dd6-bb44-3b02216d9e52
[I 2025-02-26 11:45:19,896] Trial 0 finished with value: 0.46914378993888484 and parameters: {'optimizer': 'SGD', 'lr': 4.767355964518957e-05, 'num_epochs': 6, 'momentum': 0.393634914527053}. Best is trial 0 with value: 0.46914378993888484.
[I 2025-02-26 11:45:20,387] Trial 1 finished with value: 0.6585493418849978 and parameters: {'optimizer': 'SGD', 'lr': 0.0002782321701996614, 'num_epochs': 7, 'momentum': 0.4709559451915823}. Best is trial 1 with value: 0.6585493418849978.
[I 2025-02-26 11:45:20,690] Trial 2 finished with value: 0.5240669389734746 and parameters: {'optimizer': 'AdamW', 'lr': 1.5941949412146972e-05, 'num_epochs': 3}. Best is trial 1 with value: 0.6585493418849978.
[I 2025-02-26 11:45:21,144] Trial 3 finished with value: 0.7603114938930041 and parameters: {'optimizer': 'AdamW', 'lr': 0.002552614011106603, 'num_epochs': 7}. Best is trial 3 with value: 0.7603114938930041.
[I 2025-02-26 11:45:21,457] Trial 4 finished with value: 0.7557473084517059 and parameters: {'optimizer': 'SGD', 'lr': 0.0027709334450289076, 'num_epochs': 3, 'momentum': 0.3001585771915244}. Best is trial 3 with value: 0.7603114938930041.
[I 2025-02-26 11:45:21,789] Trial 5 finished with value: 0.7562630867430501 and parameters: {'optimizer': 'SGD', 'lr': 0.006816300171002646, 'num_epochs': 6, 'momentum': 0.35417334994578403}. Best is trial 3 with value: 0.7603114938930041.
[I 2025-02-26 11:45:22,252] Trial 6 finished with value: 0.5964804013298032 and parameters: {'optimizer': 'SGD', 'lr': 2.5535281744048477e-05, 'num_epochs': 7, 'momentum': 0.8023649804443136}. Best is trial 3 with value: 0.7603114938930041.
[I 2025-02-26 11:45:22,779] Trial 7 finished with value: 0.4598425880849786 and parameters: {'optimizer': 'SGD', 'lr': 2.0759089855990554e-05, 'num_epochs': 10, 'momentum': 0.19369373310581484}. Best is trial 3 with value: 0.7603114938930041.
[I 2025-02-26 11:45:23,025] Trial 8 finished with value: 0.7262266927029136 and parameters: {'optimizer': 'AdamW', 'lr': 0.0015143143184363538, 'num_epochs': 1}. Best is trial 3 with value: 0.7603114938930041.
[I 2025-02-26 11:45:23,683] Trial 9 finished with value: 0.7631347013824669 and parameters: {'optimizer': 'AdamW', 'lr': 0.008900790948968004, 'num_epochs': 10}. Best is trial 9 with value: 0.7631347013824669.
[I 2025-02-26 11:45:24,314] Trial 10 finished with value: 0.7483617252693359 and parameters: {'optimizer': 'AdamW', 'lr': 0.00032350121756598207, 'num_epochs': 10}. Best is trial 9 with value: 0.7631347013824669.
[I 2025-02-26 11:45:24,874] Trial 11 finished with value: 0.7622189686967821 and parameters: {'optimizer': 'AdamW', 'lr': 0.009118936804609613, 'num_epochs': 9}. Best is trial 9 with value: 0.7631347013824669.
[I 2025-02-26 11:45:25,424] Trial 12 finished with value: 0.7653317359287538 and parameters: {'optimizer': 'AdamW', 'lr': 0.009147127981272082, 'num_epochs': 9}. Best is trial 12 with value: 0.7653317359287538.
[I 2025-02-26 11:45:25,982] Trial 13 finished with value: 0.7609394765845703 and parameters: {'optimizer': 'AdamW', 'lr': 0.0006202508561724199, 'num_epochs': 9}. Best is trial 12 with value: 0.7653317359287538.
[I 2025-02-26 11:45:26,551] Trial 14 finished with value: 0.7619837014059936 and parameters: {'optimizer': 'AdamW', 'lr': 0.009924410071651004, 'num_epochs': 9}. Best is trial 12 with value: 0.7653317359287538.
[I 2025-02-26 11:45:27,056] Trial 15 finished with value: 0.7602499624477208 and parameters: {'optimizer': 'AdamW', 'lr': 0.003792609193292095, 'num_epochs': 8}. Best is trial 12 with value: 0.7653317359287538.
[I 2025-02-26 11:45:27,376] Trial 16 finished with value: 0.7551989546893295 and parameters: {'optimizer': 'AdamW', 'lr': 0.0007967773604919099, 'num_epochs': 4}. Best is trial 12 with value: 0.7653317359287538.
[I 2025-02-26 11:45:27,995] Trial 17 finished with value: 0.7301248907364409 and parameters: {'optimizer': 'AdamW', 'lr': 8.712512041720551e-05, 'num_epochs': 10}. Best is trial 12 with value: 0.7653317359287538.
[I 2025-02-26 11:45:28,516] Trial 18 finished with value: 0.7605033272224163 and parameters: {'optimizer': 'AdamW', 'lr': 0.001321754664291441, 'num_epochs': 8}. Best is trial 12 with value: 0.7653317359287538.
[I 2025-02-26 11:45:28,902] Trial 19 finished with value: 0.7613593382112086 and parameters: {'optimizer': 'AdamW', 'lr': 0.0047381380892401554, 'num_epochs': 5}. Best is trial 12 with value: 0.7653317359287538.
Лучшие параметры для df6_noniid: {'optimizer': 'AdamW', 'lr': 0.009147127981272082, 'num_epochs': 9}
