[I 2025-02-23 18:14:28,098] A new study created in memory with name: no-name-704c7fa1-c510-434b-ba88-3ac52438905f
C:\Users\Астемир\AppData\Local\Temp\ipykernel_12220\469718015.py:29: FutureWarning: suggest_loguniform has been deprecated in v3.0.0. This feature will be removed in v6.0.0. See https://github.com/optuna/optuna/releases/tag/v3.0.0. Use suggest_float(..., log=True) instead.
  lr = trial.suggest_loguniform("lr", 1e-5, 1e-2)
[I 2025-02-23 18:14:28,956] Trial 0 finished with value: 0.748048638797748 and parameters: {'optimizer': 'SGD', 'lr': 0.007962258932175083, 'momentum': 0.9864537443903023}. Best is trial 0 with value: 0.748048638797748.
C:\Users\Астемир\AppData\Local\Temp\ipykernel_12220\469718015.py:29: FutureWarning: suggest_loguniform has been deprecated in v3.0.0. This feature will be removed in v6.0.0. See https://github.com/optuna/optuna/releases/tag/v3.0.0. Use suggest_float(..., log=True) instead.
  lr = trial.suggest_loguniform("lr", 1e-5, 1e-2)
[I 2025-02-23 18:14:29,698] Trial 1 finished with value: 0.7425316208287561 and parameters: {'optimizer': 'AdamW', 'lr': 0.00020000607749026732, 'momentum': 0.5165515858111968}. Best is trial 0 with value: 0.748048638797748.
C:\Users\Астемир\AppData\Local\Temp\ipykernel_12220\469718015.py:29: FutureWarning: suggest_loguniform has been deprecated in v3.0.0. This feature will be removed in v6.0.0. See https://github.com/optuna/optuna/releases/tag/v3.0.0. Use suggest_float(..., log=True) instead.
  lr = trial.suggest_loguniform("lr", 1e-5, 1e-2)
[I 2025-02-23 18:14:30,283] Trial 2 finished with value: 0.7503614972410386 and parameters: {'optimizer': 'SGD', 'lr': 0.004657143320090372, 'momentum': 0.5701357388293952}. Best is trial 2 with value: 0.7503614972410386.
C:\Users\Астемир\AppData\Local\Temp\ipykernel_12220\469718015.py:29: FutureWarning: suggest_loguniform has been deprecated in v3.0.0. This feature will be removed in v6.0.0. See https://github.com/optuna/optuna/releases/tag/v3.0.0. Use suggest_float(..., log=True) instead.
  lr = trial.suggest_loguniform("lr", 1e-5, 1e-2)
[I 2025-02-23 18:14:30,858] Trial 3 finished with value: 0.6277238975465241 and parameters: {'optimizer': 'SGD', 'lr': 9.081858582649771e-05, 'momentum': 0.6783437588977159}. Best is trial 2 with value: 0.7503614972410386.
C:\Users\Астемир\AppData\Local\Temp\ipykernel_12220\469718015.py:29: FutureWarning: suggest_loguniform has been deprecated in v3.0.0. This feature will be removed in v6.0.0. See https://github.com/optuna/optuna/releases/tag/v3.0.0. Use suggest_float(..., log=True) instead.
  lr = trial.suggest_loguniform("lr", 1e-5, 1e-2)
[I 2025-02-23 18:14:31,536] Trial 4 finished with value: 0.7414774423911843 and parameters: {'optimizer': 'SGD', 'lr': 0.00031358038420815443, 'momentum': 0.8717834231459572}. Best is trial 2 with value: 0.7503614972410386.
C:\Users\Астемир\AppData\Local\Temp\ipykernel_12220\469718015.py:29: FutureWarning: suggest_loguniform has been deprecated in v3.0.0. This feature will be removed in v6.0.0. See https://github.com/optuna/optuna/releases/tag/v3.0.0. Use suggest_float(..., log=True) instead.
  lr = trial.suggest_loguniform("lr", 1e-5, 1e-2)
[I 2025-02-23 18:14:32,257] Trial 5 finished with value: 0.7532480459241753 and parameters: {'optimizer': 'AdamW', 'lr': 0.0022400650891724, 'momentum': 0.8999870409213584}. Best is trial 5 with value: 0.7532480459241753.
C:\Users\Астемир\AppData\Local\Temp\ipykernel_12220\469718015.py:29: FutureWarning: suggest_loguniform has been deprecated in v3.0.0. This feature will be removed in v6.0.0. See https://github.com/optuna/optuna/releases/tag/v3.0.0. Use suggest_float(..., log=True) instead.
  lr = trial.suggest_loguniform("lr", 1e-5, 1e-2)
[I 2025-02-23 18:14:32,932] Trial 6 finished with value: 0.7514220097979778 and parameters: {'optimizer': 'AdamW', 'lr': 0.000487679075713934, 'momentum': 0.5245940069242143}. Best is trial 5 with value: 0.7532480459241753.
C:\Users\Астемир\AppData\Local\Temp\ipykernel_12220\469718015.py:29: FutureWarning: suggest_loguniform has been deprecated in v3.0.0. This feature will be removed in v6.0.0. See https://github.com/optuna/optuna/releases/tag/v3.0.0. Use suggest_float(..., log=True) instead.
  lr = trial.suggest_loguniform("lr", 1e-5, 1e-2)
[I 2025-02-23 18:14:33,619] Trial 7 finished with value: 0.46412083328054904 and parameters: {'optimizer': 'SGD', 'lr': 1.452333235930158e-05, 'momentum': 0.8436698960006358}. Best is trial 5 with value: 0.7532480459241753.
C:\Users\Астемир\AppData\Local\Temp\ipykernel_12220\469718015.py:29: FutureWarning: suggest_loguniform has been deprecated in v3.0.0. This feature will be removed in v6.0.0. See https://github.com/optuna/optuna/releases/tag/v3.0.0. Use suggest_float(..., log=True) instead.
  lr = trial.suggest_loguniform("lr", 1e-5, 1e-2)
[I 2025-02-23 18:14:34,301] Trial 8 finished with value: 0.6214585486179857 and parameters: {'optimizer': 'SGD', 'lr': 5.02642396601899e-05, 'momentum': 0.8348468784631287}. Best is trial 5 with value: 0.7532480459241753.
C:\Users\Астемир\AppData\Local\Temp\ipykernel_12220\469718015.py:29: FutureWarning: suggest_loguniform has been deprecated in v3.0.0. This feature will be removed in v6.0.0. See https://github.com/optuna/optuna/releases/tag/v3.0.0. Use suggest_float(..., log=True) instead.
  lr = trial.suggest_loguniform("lr", 1e-5, 1e-2)
[I 2025-02-23 18:14:34,909] Trial 9 finished with value: 0.7530254468721214 and parameters: {'optimizer': 'SGD', 'lr': 0.008340132357146864, 'momentum': 0.9663822456756841}. Best is trial 5 with value: 0.7532480459241753.
C:\Users\Астемир\AppData\Local\Temp\ipykernel_12220\469718015.py:29: FutureWarning: suggest_loguniform has been deprecated in v3.0.0. This feature will be removed in v6.0.0. See https://github.com/optuna/optuna/releases/tag/v3.0.0. Use suggest_float(..., log=True) instead.
  lr = trial.suggest_loguniform("lr", 1e-5, 1e-2)
[I 2025-02-23 18:14:35,581] Trial 10 finished with value: 0.752886096246039 and parameters: {'optimizer': 'AdamW', 'lr': 0.0014253316237139366, 'momentum': 0.7296773114426649}. Best is trial 5 with value: 0.7532480459241753.
C:\Users\Астемир\AppData\Local\Temp\ipykernel_12220\469718015.py:29: FutureWarning: suggest_loguniform has been deprecated in v3.0.0. This feature will be removed in v6.0.0. See https://github.com/optuna/optuna/releases/tag/v3.0.0. Use suggest_float(..., log=True) instead.
  lr = trial.suggest_loguniform("lr", 1e-5, 1e-2)
[I 2025-02-23 18:14:36,235] Trial 11 finished with value: 0.7515758384111857 and parameters: {'optimizer': 'AdamW', 'lr': 0.0021027153744205673, 'momentum': 0.977278624378621}. Best is trial 5 with value: 0.7532480459241753.
C:\Users\Астемир\AppData\Local\Temp\ipykernel_12220\469718015.py:29: FutureWarning: suggest_loguniform has been deprecated in v3.0.0. This feature will be removed in v6.0.0. See https://github.com/optuna/optuna/releases/tag/v3.0.0. Use suggest_float(..., log=True) instead.
  lr = trial.suggest_loguniform("lr", 1e-5, 1e-2)
[I 2025-02-23 18:14:36,910] Trial 12 finished with value: 0.7511559767845477 and parameters: {'optimizer': 'AdamW', 'lr': 0.0016713064454607456, 'momentum': 0.9157695207263976}. Best is trial 5 with value: 0.7532480459241753.
C:\Users\Астемир\AppData\Local\Temp\ipykernel_12220\469718015.py:29: FutureWarning: suggest_loguniform has been deprecated in v3.0.0. This feature will be removed in v6.0.0. See https://github.com/optuna/optuna/releases/tag/v3.0.0. Use suggest_float(..., log=True) instead.
  lr = trial.suggest_loguniform("lr", 1e-5, 1e-2)
[I 2025-02-23 18:14:37,593] Trial 13 finished with value: 0.7481029312494685 and parameters: {'optimizer': 'AdamW', 'lr': 0.009442152583345891, 'momentum': 0.7870819815924782}. Best is trial 5 with value: 0.7532480459241753.
C:\Users\Астемир\AppData\Local\Temp\ipykernel_12220\469718015.py:29: FutureWarning: suggest_loguniform has been deprecated in v3.0.0. This feature will be removed in v6.0.0. See https://github.com/optuna/optuna/releases/tag/v3.0.0. Use suggest_float(..., log=True) instead.
  lr = trial.suggest_loguniform("lr", 1e-5, 1e-2)
[I 2025-02-23 18:14:38,186] Trial 14 finished with value: 0.7540633375741771 and parameters: {'optimizer': 'SGD', 'lr': 0.0027193201783833553, 'momentum': 0.9234102114105126}. Best is trial 14 with value: 0.7540633375741771.
C:\Users\Астемир\AppData\Local\Temp\ipykernel_12220\469718015.py:29: FutureWarning: suggest_loguniform has been deprecated in v3.0.0. This feature will be removed in v6.0.0. See https://github.com/optuna/optuna/releases/tag/v3.0.0. Use suggest_float(..., log=True) instead.
  lr = trial.suggest_loguniform("lr", 1e-5, 1e-2)
[I 2025-02-23 18:14:38,932] Trial 15 finished with value: 0.7521658163865477 and parameters: {'optimizer': 'AdamW', 'lr': 0.0006974395064503928, 'momentum': 0.9144975520092554}. Best is trial 14 with value: 0.7540633375741771.
C:\Users\Астемир\AppData\Local\Temp\ipykernel_12220\469718015.py:29: FutureWarning: suggest_loguniform has been deprecated in v3.0.0. This feature will be removed in v6.0.0. See https://github.com/optuna/optuna/releases/tag/v3.0.0. Use suggest_float(..., log=True) instead.
  lr = trial.suggest_loguniform("lr", 1e-5, 1e-2)
[I 2025-02-23 18:14:39,608] Trial 16 finished with value: 0.7590989624712476 and parameters: {'optimizer': 'SGD', 'lr': 0.0034866966982700994, 'momentum': 0.6796953509859821}. Best is trial 16 with value: 0.7590989624712476.
C:\Users\Астемир\AppData\Local\Temp\ipykernel_12220\469718015.py:29: FutureWarning: suggest_loguniform has been deprecated in v3.0.0. This feature will be removed in v6.0.0. See https://github.com/optuna/optuna/releases/tag/v3.0.0. Use suggest_float(..., log=True) instead.
  lr = trial.suggest_loguniform("lr", 1e-5, 1e-2)
[I 2025-02-23 18:14:40,286] Trial 17 finished with value: 0.7403427301502273 and parameters: {'optimizer': 'SGD', 'lr': 0.0008695622224952634, 'momentum': 0.6300520372935113}. Best is trial 16 with value: 0.7590989624712476.
C:\Users\Астемир\AppData\Local\Temp\ipykernel_12220\469718015.py:29: FutureWarning: suggest_loguniform has been deprecated in v3.0.0. This feature will be removed in v6.0.0. See https://github.com/optuna/optuna/releases/tag/v3.0.0. Use suggest_float(..., log=True) instead.
  lr = trial.suggest_loguniform("lr", 1e-5, 1e-2)
[I 2025-02-23 18:14:40,951] Trial 18 finished with value: 0.7564802565499319 and parameters: {'optimizer': 'SGD', 'lr': 0.0037145656974502768, 'momentum': 0.7415438386317973}. Best is trial 16 with value: 0.7590989624712476.
C:\Users\Астемир\AppData\Local\Temp\ipykernel_12220\469718015.py:29: FutureWarning: suggest_loguniform has been deprecated in v3.0.0. This feature will be removed in v6.0.0. See https://github.com/optuna/optuna/releases/tag/v3.0.0. Use suggest_float(..., log=True) instead.
  lr = trial.suggest_loguniform("lr", 1e-5, 1e-2)
[I 2025-02-23 18:14:41,584] Trial 19 finished with value: 0.7570639004059265 and parameters: {'optimizer': 'SGD', 'lr': 0.00429770703072679, 'momentum': 0.7112223940425103}. Best is trial 16 with value: 0.7590989624712476.
Лучшие параметры для df4_noniid: {'optimizer': 'SGD', 'lr': 0.0034866966982700994, 'momentum': 0.6796953509859821}
