[I 2025-02-26 11:43:51,857] A new study created in memory with name: no-name-cc216ae0-9d11-4138-810d-85ce3ba0318f
[I 2025-02-26 11:43:54,489] Trial 0 finished with value: 0.7864315924157065 and parameters: {'optimizer': 'AdamW', 'lr': 0.0012441036146380925, 'num_epochs': 10}. Best is trial 0 with value: 0.7864315924157065.
[I 2025-02-26 11:43:56,198] Trial 1 finished with value: 0.7047558377958713 and parameters: {'optimizer': 'SGD', 'lr': 8.997053092126632e-05, 'num_epochs': 9, 'momentum': 0.10218202552147264}. Best is trial 0 with value: 0.7864315924157065.
[I 2025-02-26 11:43:57,154] Trial 2 finished with value: 0.5617060860028631 and parameters: {'optimizer': 'SGD', 'lr': 0.00015682365329071365, 'num_epochs': 3, 'momentum': 0.2500125155923932}. Best is trial 0 with value: 0.7864315924157065.
[I 2025-02-26 11:43:58,925] Trial 3 finished with value: 0.719711598496461 and parameters: {'optimizer': 'AdamW', 'lr': 1.0819780206461899e-05, 'num_epochs': 8}. Best is trial 0 with value: 0.7864315924157065.
[I 2025-02-26 11:43:59,557] Trial 4 finished with value: 0.656526043184216 and parameters: {'optimizer': 'SGD', 'lr': 1.2378051750963794e-05, 'num_epochs': 1, 'momentum': 0.9872938264161999}. Best is trial 0 with value: 0.7864315924157065.
[I 2025-02-26 11:44:00,943] Trial 5 finished with value: 0.783359544522525 and parameters: {'optimizer': 'AdamW', 'lr': 0.00019801814128784267, 'num_epochs': 6}. Best is trial 0 with value: 0.7864315924157065.
[I 2025-02-26 11:44:01,593] Trial 6 finished with value: 0.6770404460667834 and parameters: {'optimizer': 'AdamW', 'lr': 9.668379396893247e-05, 'num_epochs': 1}. Best is trial 0 with value: 0.7864315924157065.
[I 2025-02-26 11:44:03,148] Trial 7 finished with value: 0.7661714591820299 and parameters: {'optimizer': 'AdamW', 'lr': 4.450581813913392e-05, 'num_epochs': 6}. Best is trial 0 with value: 0.7864315924157065.
[I 2025-02-26 11:44:04,919] Trial 8 finished with value: 0.7837477355523261 and parameters: {'optimizer': 'SGD', 'lr': 0.004870765512258247, 'num_epochs': 9, 'momentum': 0.7709885091286428}. Best is trial 0 with value: 0.7864315924157065.
[I 2025-02-26 11:44:05,834] Trial 9 finished with value: 0.5918908794110356 and parameters: {'optimizer': 'SGD', 'lr': 0.00010834054774190943, 'num_epochs': 3, 'momentum': 0.4299515158865503}. Best is trial 0 with value: 0.7864315924157065.
[I 2025-02-26 11:44:07,804] Trial 10 finished with value: 0.7839902418366773 and parameters: {'optimizer': 'AdamW', 'lr': 0.0017956658972068603, 'num_epochs': 10}. Best is trial 0 with value: 0.7864315924157065.
[I 2025-02-26 11:44:09,770] Trial 11 finished with value: 0.7860171600342405 and parameters: {'optimizer': 'AdamW', 'lr': 0.0016373802649105082, 'num_epochs': 10}. Best is trial 0 with value: 0.7864315924157065.
[I 2025-02-26 11:44:11,606] Trial 12 finished with value: 0.7823071758333439 and parameters: {'optimizer': 'AdamW', 'lr': 0.0009429893283928564, 'num_epochs': 8}. Best is trial 0 with value: 0.7864315924157065.
[I 2025-02-26 11:44:13,867] Trial 13 finished with value: 0.7848154871028281 and parameters: {'optimizer': 'AdamW', 'lr': 0.0006395691410402534, 'num_epochs': 10}. Best is trial 0 with value: 0.7864315924157065.
[I 2025-02-26 11:44:15,651] Trial 14 finished with value: 0.7776126885079168 and parameters: {'optimizer': 'AdamW', 'lr': 0.006951480861853337, 'num_epochs': 7}. Best is trial 0 with value: 0.7864315924157065.
[I 2025-02-26 11:44:16,850] Trial 15 finished with value: 0.78373144781681 and parameters: {'optimizer': 'AdamW', 'lr': 0.002355678596265175, 'num_epochs': 4}. Best is trial 0 with value: 0.7864315924157065.
[I 2025-02-26 11:44:19,085] Trial 16 finished with value: 0.7856153958915092 and parameters: {'optimizer': 'AdamW', 'lr': 0.0005162424200773919, 'num_epochs': 10}. Best is trial 0 with value: 0.7864315924157065.
[I 2025-02-26 11:44:21,123] Trial 17 finished with value: 0.7845168786183657 and parameters: {'optimizer': 'AdamW', 'lr': 0.0018166481837908705, 'num_epochs': 8}. Best is trial 0 with value: 0.7864315924157065.
[I 2025-02-26 11:44:22,545] Trial 18 finished with value: 0.7846707072315737 and parameters: {'optimizer': 'AdamW', 'lr': 0.003657486428083683, 'num_epochs': 5}. Best is trial 0 with value: 0.7864315924157065.
[I 2025-02-26 11:44:24,605] Trial 19 finished with value: 0.7860750719827423 and parameters: {'optimizer': 'AdamW', 'lr': 0.000350133587844183, 'num_epochs': 9}. Best is trial 0 with value: 0.7864315924157065.
Лучшие параметры для df2_noniid: {'optimizer': 'AdamW', 'lr': 0.0012441036146380925, 'num_epochs': 10}
