[I 2025-02-26 11:44:27,649] A new study created in memory with name: no-name-9ee5a348-0cc1-4db7-9632-54b4acadcce5
[I 2025-02-26 11:44:28,471] Trial 0 finished with value: 0.5282746039818083 and parameters: {'optimizer': 'SGD', 'lr': 2.8430916579087718e-05, 'num_epochs': 5, 'momentum': 0.5005144900875551}. Best is trial 0 with value: 0.5282746039818083.
[I 2025-02-26 11:44:29,528] Trial 1 finished with value: 0.6597003418614711 and parameters: {'optimizer': 'AdamW', 'lr': 1.4348594177217474e-05, 'num_epochs': 7}. Best is trial 1 with value: 0.6597003418614711.
[I 2025-02-26 11:44:30,558] Trial 2 finished with value: 0.7851629587938389 and parameters: {'optimizer': 'SGD', 'lr': 0.0034836489869738106, 'num_epochs': 7, 'momentum': 0.3303454719808816}. Best is trial 2 with value: 0.7851629587938389.
[I 2025-02-26 11:44:31,342] Trial 3 finished with value: 0.7557310207161898 and parameters: {'optimizer': 'AdamW', 'lr': 6.390170338280485e-05, 'num_epochs': 4}. Best is trial 2 with value: 0.7851629587938389.
[I 2025-02-26 11:44:32,636] Trial 4 finished with value: 0.6050115552434745 and parameters: {'optimizer': 'SGD', 'lr': 2.1485244277442778e-05, 'num_epochs': 9, 'momentum': 0.43262010924826527}. Best is trial 2 with value: 0.7851629587938389.
[I 2025-02-26 11:44:33,687] Trial 5 finished with value: 0.7936542982429153 and parameters: {'optimizer': 'AdamW', 'lr': 0.0022480291110095786, 'num_epochs': 6}. Best is trial 5 with value: 0.7936542982429153.
[I 2025-02-26 11:44:34,645] Trial 6 finished with value: 0.6306013974877073 and parameters: {'optimizer': 'SGD', 'lr': 6.662373031390092e-05, 'num_epochs': 6, 'momentum': 0.20329529258212958}. Best is trial 5 with value: 0.7936542982429153.
[I 2025-02-26 11:44:35,471] Trial 7 finished with value: 0.5715375441352389 and parameters: {'optimizer': 'SGD', 'lr': 1.1974114963387081e-05, 'num_epochs': 5, 'momentum': 0.09799787929521268}. Best is trial 5 with value: 0.7936542982429153.
[I 2025-02-26 11:44:36,475] Trial 8 finished with value: 0.7167345623937905 and parameters: {'optimizer': 'AdamW', 'lr': 2.7252416829705012e-05, 'num_epochs': 6}. Best is trial 5 with value: 0.7936542982429153.
[I 2025-02-26 11:44:37,615] Trial 9 finished with value: 0.7409960493192631 and parameters: {'optimizer': 'SGD', 'lr': 0.0004240979138043937, 'num_epochs': 9, 'momentum': 0.07214843059083377}. Best is trial 5 with value: 0.7936542982429153.
[I 2025-02-26 11:44:38,093] Trial 10 finished with value: 0.7870034729071618 and parameters: {'optimizer': 'AdamW', 'lr': 0.0071315964878402045, 'num_epochs': 1}. Best is trial 5 with value: 0.7936542982429153.
[I 2025-02-26 11:44:38,636] Trial 11 finished with value: 0.7823614682850644 and parameters: {'optimizer': 'AdamW', 'lr': 0.009738645776820449, 'num_epochs': 1}. Best is trial 5 with value: 0.7936542982429153.
[I 2025-02-26 11:44:39,223] Trial 12 finished with value: 0.7828410516085949 and parameters: {'optimizer': 'AdamW', 'lr': 0.0013297136888237645, 'num_epochs': 2}. Best is trial 5 with value: 0.7936542982429153.
[I 2025-02-26 11:44:39,900] Trial 13 finished with value: 0.7949971315488008 and parameters: {'optimizer': 'AdamW', 'lr': 0.008109986042927307, 'num_epochs': 3}. Best is trial 13 with value: 0.7949971315488008.
[I 2025-02-26 11:44:40,532] Trial 14 finished with value: 0.788308301496843 and parameters: {'optimizer': 'AdamW', 'lr': 0.0012542816174220329, 'num_epochs': 3}. Best is trial 13 with value: 0.7949971315488008.
[I 2025-02-26 11:44:41,179] Trial 15 finished with value: 0.7925413029826464 and parameters: {'optimizer': 'AdamW', 'lr': 0.0027657858858066106, 'num_epochs': 3}. Best is trial 13 with value: 0.7949971315488008.
[I 2025-02-26 11:44:42,059] Trial 16 finished with value: 0.7813262922055947 and parameters: {'optimizer': 'AdamW', 'lr': 0.00041658475317372164, 'num_epochs': 4}. Best is trial 13 with value: 0.7949971315488008.
[I 2025-02-26 11:44:43,220] Trial 17 finished with value: 0.792753043544356 and parameters: {'optimizer': 'AdamW', 'lr': 0.0011801222411338486, 'num_epochs': 8}. Best is trial 13 with value: 0.7949971315488008.
[I 2025-02-26 11:44:44,616] Trial 18 finished with value: 0.7992228940410415 and parameters: {'optimizer': 'AdamW', 'lr': 0.0032639554000816863, 'num_epochs': 10}. Best is trial 18 with value: 0.7992228940410415.
[I 2025-02-26 11:44:46,086] Trial 19 finished with value: 0.7999793688683463 and parameters: {'optimizer': 'AdamW', 'lr': 0.005132665516935493, 'num_epochs': 10}. Best is trial 19 with value: 0.7999793688683463.
Лучшие параметры для df3_noniid: {'optimizer': 'AdamW', 'lr': 0.005132665516935493, 'num_epochs': 10}
