[I 2025-02-26 11:43:11,381] A new study created in memory with name: no-name-faf477fd-cbf1-401e-8a5a-6e1c1ea684c3
[I 2025-02-26 11:43:14,898] Trial 0 finished with value: 0.7652141022833595 and parameters: {'optimizer': 'AdamW', 'lr': 3.6735440558181095e-05, 'num_epochs': 6}. Best is trial 0 with value: 0.7652141022833595.
[I 2025-02-26 11:43:16,244] Trial 1 finished with value: 0.7782895344060314 and parameters: {'optimizer': 'AdamW', 'lr': 0.0003215873866056555, 'num_epochs': 4}. Best is trial 1 with value: 0.7782895344060314.
[I 2025-02-26 11:43:17,389] Trial 2 finished with value: 0.7786931082971533 and parameters: {'optimizer': 'SGD', 'lr': 0.0026600450418942175, 'num_epochs': 3, 'momentum': 0.35963150039434577}. Best is trial 2 with value: 0.7786931082971533.
[I 2025-02-26 11:43:19,435] Trial 3 finished with value: 0.7792649887886087 and parameters: {'optimizer': 'AdamW', 'lr': 0.0003602514611161844, 'num_epochs': 6}. Best is trial 3 with value: 0.7792649887886087.
[I 2025-02-26 11:43:22,393] Trial 4 finished with value: 0.7780126429022574 and parameters: {'optimizer': 'SGD', 'lr': 0.0033150180343811007, 'num_epochs': 8, 'momentum': 0.48399774712497956}. Best is trial 3 with value: 0.7792649887886087.
[I 2025-02-26 11:43:24,122] Trial 5 finished with value: 0.7757341696783897 and parameters: {'optimizer': 'AdamW', 'lr': 0.00021669676109776606, 'num_epochs': 5}. Best is trial 3 with value: 0.7792649887886087.
[I 2025-02-26 11:43:26,404] Trial 6 finished with value: 0.7386325179210335 and parameters: {'optimizer': 'SGD', 'lr': 5.6015684449314044e-05, 'num_epochs': 8, 'momentum': 0.7693337904151714}. Best is trial 3 with value: 0.7792649887886087.
[I 2025-02-26 11:43:27,517] Trial 7 finished with value: 0.7747460470570777 and parameters: {'optimizer': 'AdamW', 'lr': 0.0009624104226298701, 'num_epochs': 2}. Best is trial 3 with value: 0.7792649887886087.
[I 2025-02-26 11:43:28,961] Trial 8 finished with value: 0.781130839379401 and parameters: {'optimizer': 'SGD', 'lr': 0.0006779274767952471, 'num_epochs': 5, 'momentum': 0.8217145481796597}. Best is trial 8 with value: 0.781130839379401.
[I 2025-02-26 11:43:29,848] Trial 9 finished with value: 0.7284961171848279 and parameters: {'optimizer': 'SGD', 'lr': 5.1249687876793785e-05, 'num_epochs': 1, 'momentum': 0.9542513016577688}. Best is trial 8 with value: 0.781130839379401.
[I 2025-02-26 11:43:32,462] Trial 10 finished with value: 0.7766698095963718 and parameters: {'optimizer': 'SGD', 'lr': 0.009185149412104705, 'num_epochs': 10, 'momentum': 0.04454298164400494}. Best is trial 8 with value: 0.781130839379401.
[I 2025-02-26 11:43:34,243] Trial 11 finished with value: 0.7769467011001461 and parameters: {'optimizer': 'AdamW', 'lr': 0.00032071557030708434, 'num_epochs': 6}. Best is trial 8 with value: 0.781130839379401.
[I 2025-02-26 11:43:36,000] Trial 12 finished with value: 0.7807887969335623 and parameters: {'optimizer': 'SGD', 'lr': 0.000867729712495172, 'num_epochs': 7, 'momentum': 0.7613495636819282}. Best is trial 8 with value: 0.781130839379401.
[I 2025-02-26 11:43:37,998] Trial 13 finished with value: 0.6078492407200626 and parameters: {'optimizer': 'SGD', 'lr': 1.076777465022031e-05, 'num_epochs': 8, 'momentum': 0.756297514150837}. Best is trial 8 with value: 0.781130839379401.
[I 2025-02-26 11:43:40,371] Trial 14 finished with value: 0.7795654070214618 and parameters: {'optimizer': 'SGD', 'lr': 0.001101512980774304, 'num_epochs': 10, 'momentum': 0.7560987464991288}. Best is trial 8 with value: 0.781130839379401.
[I 2025-02-26 11:43:41,684] Trial 15 finished with value: 0.7782488150672413 and parameters: {'optimizer': 'SGD', 'lr': 0.0010678416095875859, 'num_epochs': 4, 'momentum': 0.9021267177622257}. Best is trial 8 with value: 0.781130839379401.
[I 2025-02-26 11:43:43,692] Trial 16 finished with value: 0.7647725236760333 and parameters: {'optimizer': 'SGD', 'lr': 0.000130963424477738, 'num_epochs': 7, 'momentum': 0.589278769711792}. Best is trial 8 with value: 0.781130839379401.
[I 2025-02-26 11:43:45,039] Trial 17 finished with value: 0.7795654070214617 and parameters: {'optimizer': 'SGD', 'lr': 0.0030833328714652886, 'num_epochs': 4, 'momentum': 0.5460143557701614}. Best is trial 8 with value: 0.781130839379401.
[I 2025-02-26 11:43:46,895] Trial 18 finished with value: 0.777963779695709 and parameters: {'optimizer': 'SGD', 'lr': 0.0007716320048894101, 'num_epochs': 7, 'momentum': 0.6859754526151118}. Best is trial 8 with value: 0.781130839379401.
[I 2025-02-26 11:43:48,833] Trial 19 finished with value: 0.748263998856239 and parameters: {'optimizer': 'SGD', 'lr': 0.009084189968942988, 'num_epochs': 9, 'momentum': 0.9898623059130593}. Best is trial 8 with value: 0.781130839379401.
Лучшие параметры для df1_noniid: {'optimizer': 'SGD', 'lr': 0.0006779274767952471, 'num_epochs': 5, 'momentum': 0.8217145481796597}
