[I 2025-02-26 11:45:04,454] A new study created in memory with name: no-name-a0446f3b-b057-4a10-8766-11373f614201
[I 2025-02-26 11:45:04,781] Trial 0 finished with value: 0.6667275948624862 and parameters: {'optimizer': 'AdamW', 'lr': 7.123851879176432e-05, 'num_epochs': 2}. Best is trial 0 with value: 0.6667275948624862.
[I 2025-02-26 11:45:05,760] Trial 1 finished with value: 0.741962454959887 and parameters: {'optimizer': 'AdamW', 'lr': 4.662603594201888e-05, 'num_epochs': 10}. Best is trial 1 with value: 0.741962454959887.
[I 2025-02-26 11:45:06,240] Trial 2 finished with value: 0.7448272866623354 and parameters: {'optimizer': 'AdamW', 'lr': 0.007830302340838525, 'num_epochs': 4}. Best is trial 2 with value: 0.7448272866623354.
[I 2025-02-26 11:45:06,933] Trial 3 finished with value: 0.7618642580122085 and parameters: {'optimizer': 'SGD', 'lr': 0.004593705909314762, 'num_epochs': 9, 'momentum': 0.05695025535828089}. Best is trial 3 with value: 0.7618642580122085.
[I 2025-02-26 11:45:07,508] Trial 4 finished with value: 0.734487289232178 and parameters: {'optimizer': 'SGD', 'lr': 0.0008267947441099006, 'num_epochs': 7, 'momentum': 0.49269745147459704}. Best is trial 3 with value: 0.7618642580122085.
[I 2025-02-26 11:45:08,232] Trial 5 finished with value: 0.7157953029790268 and parameters: {'optimizer': 'AdamW', 'lr': 4.505857175961168e-05, 'num_epochs': 8}. Best is trial 3 with value: 0.7618642580122085.
[I 2025-02-26 11:45:09,013] Trial 6 finished with value: 0.7423117363992884 and parameters: {'optimizer': 'AdamW', 'lr': 0.00011166402702365109, 'num_epochs': 9}. Best is trial 3 with value: 0.7618642580122085.
[I 2025-02-26 11:45:09,558] Trial 7 finished with value: 0.7515559311788882 and parameters: {'optimizer': 'AdamW', 'lr': 0.0025620966461192118, 'num_epochs': 5}. Best is trial 3 with value: 0.7618642580122085.
[I 2025-02-26 11:45:09,928] Trial 8 finished with value: 0.7553364955670213 and parameters: {'optimizer': 'SGD', 'lr': 0.004432522966374689, 'num_epochs': 3, 'momentum': 0.4264456900011361}. Best is trial 3 with value: 0.7618642580122085.
[I 2025-02-26 11:45:10,457] Trial 9 finished with value: 0.7575407691068712 and parameters: {'optimizer': 'AdamW', 'lr': 0.0012951857844289035, 'num_epochs': 4}. Best is trial 3 with value: 0.7618642580122085.
[I 2025-02-26 11:45:11,035] Trial 10 finished with value: 0.5308625441804825 and parameters: {'optimizer': 'SGD', 'lr': 1.0908718635556485e-05, 'num_epochs': 7, 'momentum': 0.10899016898079292}. Best is trial 3 with value: 0.7618642580122085.
[I 2025-02-26 11:45:11,308] Trial 11 finished with value: 0.7603712155898966 and parameters: {'optimizer': 'SGD', 'lr': 0.0011373662229810237, 'num_epochs': 1, 'momentum': 0.9845758153483017}. Best is trial 3 with value: 0.7618642580122085.
[I 2025-02-26 11:45:11,576] Trial 12 finished with value: 0.7486241387859845 and parameters: {'optimizer': 'SGD', 'lr': 0.0005709764335537498, 'num_epochs': 1, 'momentum': 0.9744645079582417}. Best is trial 3 with value: 0.7618642580122085.
[I 2025-02-26 11:45:12,177] Trial 13 finished with value: 0.7618914042380689 and parameters: {'optimizer': 'SGD', 'lr': 0.00027937212330491837, 'num_epochs': 6, 'momentum': 0.9592508126363328}. Best is trial 13 with value: 0.7618914042380689.
[I 2025-02-26 11:45:12,778] Trial 14 finished with value: 0.42887326874944576 and parameters: {'optimizer': 'SGD', 'lr': 0.0002403601764508225, 'num_epochs': 6, 'momentum': 0.00974084883142192}. Best is trial 13 with value: 0.7618914042380689.
[I 2025-02-26 11:45:13,661] Trial 15 finished with value: 0.7511903620039705 and parameters: {'optimizer': 'SGD', 'lr': 0.0002456740102783268, 'num_epochs': 10, 'momentum': 0.7224201356552936}. Best is trial 13 with value: 0.7618914042380689.
[I 2025-02-26 11:45:14,364] Trial 16 finished with value: 0.7632450960342982 and parameters: {'optimizer': 'SGD', 'lr': 0.002613097273586225, 'num_epochs': 8, 'momentum': 0.2871272177508824}. Best is trial 16 with value: 0.7632450960342982.
[I 2025-02-26 11:45:14,946] Trial 17 finished with value: 0.6752623682729391 and parameters: {'optimizer': 'SGD', 'lr': 0.00039546571512918125, 'num_epochs': 6, 'momentum': 0.2934920380838918}. Best is trial 16 with value: 0.7632450960342982.
[I 2025-02-26 11:45:15,675] Trial 18 finished with value: 0.7613539089660365 and parameters: {'optimizer': 'SGD', 'lr': 0.0022605688261135787, 'num_epochs': 8, 'momentum': 0.7384469524849734}. Best is trial 16 with value: 0.7632450960342982.
[I 2025-02-26 11:45:16,147] Trial 19 finished with value: 0.42703365951031824 and parameters: {'optimizer': 'SGD', 'lr': 0.00013901008173660271, 'num_epochs': 5, 'momentum': 0.29199684506624046}. Best is trial 16 with value: 0.7632450960342982.
Лучшие параметры для df5_noniid: {'optimizer': 'SGD', 'lr': 0.002613097273586225, 'num_epochs': 8, 'momentum': 0.2871272177508824}
