[I 2025-02-26 11:44:48,995] A new study created in memory with name: no-name-219864c0-9040-4826-ba49-aaf64e6e0471
[I 2025-02-26 11:44:49,490] Trial 0 finished with value: 0.65013401186833 and parameters: {'optimizer': 'SGD', 'lr': 0.0002158824917903471, 'num_epochs': 3, 'momentum': 0.6631121436341157}. Best is trial 0 with value: 0.65013401186833.
[I 2025-02-26 11:44:50,219] Trial 1 finished with value: 0.7566612313890001 and parameters: {'optimizer': 'AdamW', 'lr': 0.0011062001603993382, 'num_epochs': 4}. Best is trial 1 with value: 0.7566612313890001.
[I 2025-02-26 11:44:50,748] Trial 2 finished with value: 0.7371105195244706 and parameters: {'optimizer': 'SGD', 'lr': 0.0015509393251240855, 'num_epochs': 4, 'momentum': 0.4605376853293857}. Best is trial 1 with value: 0.7566612313890001.
[I 2025-02-26 11:44:51,696] Trial 3 finished with value: 0.6477125685215984 and parameters: {'optimizer': 'SGD', 'lr': 1.7856606072167977e-05, 'num_epochs': 10, 'momentum': 0.35849877137397484}. Best is trial 1 with value: 0.7566612313890001.
[I 2025-02-26 11:44:52,403] Trial 4 finished with value: 0.7523377424836624 and parameters: {'optimizer': 'AdamW', 'lr': 0.0023214652430662776, 'num_epochs': 3}. Best is trial 1 with value: 0.7566612313890001.
[I 2025-02-26 11:44:53,393] Trial 5 finished with value: 0.7146388737573816 and parameters: {'optimizer': 'AdamW', 'lr': 7.839882773324389e-05, 'num_epochs': 8}. Best is trial 1 with value: 0.7566612313890001.
[I 2025-02-26 11:44:53,916] Trial 6 finished with value: 0.7528806670008668 and parameters: {'optimizer': 'AdamW', 'lr': 0.005946533587383192, 'num_epochs': 3}. Best is trial 1 with value: 0.7566612313890001.
[I 2025-02-26 11:44:54,445] Trial 7 finished with value: 0.7562612769946594 and parameters: {'optimizer': 'AdamW', 'lr': 0.004692929147366723, 'num_epochs': 3}. Best is trial 1 with value: 0.7566612313890001.
[I 2025-02-26 11:44:55,500] Trial 8 finished with value: 0.7524716638645729 and parameters: {'optimizer': 'AdamW', 'lr': 0.00022607847400421682, 'num_epochs': 9}. Best is trial 1 with value: 0.7566612313890001.
[I 2025-02-26 11:44:55,806] Trial 9 finished with value: 0.4281231280415084 and parameters: {'optimizer': 'SGD', 'lr': 4.4562403879806306e-05, 'num_epochs': 1, 'momentum': 0.07855246417187856}. Best is trial 1 with value: 0.7566612313890001.
[I 2025-02-26 11:44:56,486] Trial 10 finished with value: 0.7558341763744586 and parameters: {'optimizer': 'AdamW', 'lr': 0.0009263707376298967, 'num_epochs': 6}. Best is trial 1 with value: 0.7566612313890001.
[I 2025-02-26 11:44:57,106] Trial 11 finished with value: 0.75400452075148 and parameters: {'optimizer': 'AdamW', 'lr': 0.00847224263760624, 'num_epochs': 5}. Best is trial 1 with value: 0.7566612313890001.
[I 2025-02-26 11:44:57,431] Trial 12 finished with value: 0.7257480142535784 and parameters: {'optimizer': 'AdamW', 'lr': 0.0006914796675575941, 'num_epochs': 1}. Best is trial 1 with value: 0.7566612313890001.
[I 2025-02-26 11:44:58,110] Trial 13 finished with value: 0.7536606685572504 and parameters: {'optimizer': 'AdamW', 'lr': 0.0033355522221085727, 'num_epochs': 6}. Best is trial 1 with value: 0.7566612313890001.
[I 2025-02-26 11:44:58,501] Trial 14 finished with value: 0.7480830240171709 and parameters: {'optimizer': 'AdamW', 'lr': 0.0006938398588001865, 'num_epochs': 2}. Best is trial 1 with value: 0.7566612313890001.
[I 2025-02-26 11:44:59,099] Trial 15 finished with value: 0.7507288761643471 and parameters: {'optimizer': 'AdamW', 'lr': 0.00482383917087313, 'num_epochs': 5}. Best is trial 1 with value: 0.7566612313890001.
[I 2025-02-26 11:44:59,858] Trial 16 finished with value: 0.753465215731057 and parameters: {'optimizer': 'AdamW', 'lr': 0.0019257493357685133, 'num_epochs': 7}. Best is trial 1 with value: 0.7566612313890001.
[I 2025-02-26 11:45:00,457] Trial 17 finished with value: 0.7484485931920886 and parameters: {'optimizer': 'AdamW', 'lr': 0.0004955732623647552, 'num_epochs': 4}. Best is trial 1 with value: 0.7566612313890001.
[I 2025-02-26 11:45:00,943] Trial 18 finished with value: 0.7475762944677802 and parameters: {'optimizer': 'SGD', 'lr': 0.009393303142874312, 'num_epochs': 4, 'momentum': 0.9768567572682838}. Best is trial 1 with value: 0.7566612313890001.
[I 2025-02-26 11:45:01,342] Trial 19 finished with value: 0.7494711010328234 and parameters: {'optimizer': 'AdamW', 'lr': 0.0013003414183798026, 'num_epochs': 2}. Best is trial 1 with value: 0.7566612313890001.
Лучшие параметры для df4_noniid: {'optimizer': 'AdamW', 'lr': 0.0011062001603993382, 'num_epochs': 4}
