[I 2025-02-23 18:11:48,029] A new study created in memory with name: no-name-633d7e10-7176-4e71-aa7a-e259ce2515e2
C:\Users\Астемир\AppData\Local\Temp\ipykernel_12220\469718015.py:29: FutureWarning: suggest_loguniform has been deprecated in v3.0.0. This feature will be removed in v6.0.0. See https://github.com/optuna/optuna/releases/tag/v3.0.0. Use suggest_float(..., log=True) instead.
  lr = trial.suggest_loguniform("lr", 1e-5, 1e-2)
[I 2025-02-23 18:11:49,060] Trial 0 finished with value: 0.7194745214572817 and parameters: {'optimizer': 'AdamW', 'lr': 3.5790860402336605e-05, 'momentum': 0.7439381125450835}. Best is trial 0 with value: 0.7194745214572817.
C:\Users\Астемир\AppData\Local\Temp\ipykernel_12220\469718015.py:29: FutureWarning: suggest_loguniform has been deprecated in v3.0.0. This feature will be removed in v6.0.0. See https://github.com/optuna/optuna/releases/tag/v3.0.0. Use suggest_float(..., log=True) instead.
  lr = trial.suggest_loguniform("lr", 1e-5, 1e-2)
[I 2025-02-23 18:11:50,073] Trial 1 finished with value: 0.7634043538926782 and parameters: {'optimizer': 'AdamW', 'lr': 0.009823272387719326, 'momentum': 0.8102799623178757}. Best is trial 1 with value: 0.7634043538926782.
C:\Users\Астемир\AppData\Local\Temp\ipykernel_12220\469718015.py:29: FutureWarning: suggest_loguniform has been deprecated in v3.0.0. This feature will be removed in v6.0.0. See https://github.com/optuna/optuna/releases/tag/v3.0.0. Use suggest_float(..., log=True) instead.
  lr = trial.suggest_loguniform("lr", 1e-5, 1e-2)
[I 2025-02-23 18:11:50,960] Trial 2 finished with value: 0.4735695296282958 and parameters: {'optimizer': 'SGD', 'lr': 3.768515954559473e-05, 'momentum': 0.5559782661684308}. Best is trial 1 with value: 0.7634043538926782.
C:\Users\Астемир\AppData\Local\Temp\ipykernel_12220\469718015.py:29: FutureWarning: suggest_loguniform has been deprecated in v3.0.0. This feature will be removed in v6.0.0. See https://github.com/optuna/optuna/releases/tag/v3.0.0. Use suggest_float(..., log=True) instead.
  lr = trial.suggest_loguniform("lr", 1e-5, 1e-2)
[I 2025-02-23 18:11:51,824] Trial 3 finished with value: 0.7706433474554033 and parameters: {'optimizer': 'SGD', 'lr': 0.0011977517420103724, 'momentum': 0.6643207652549504}. Best is trial 3 with value: 0.7706433474554033.
C:\Users\Астемир\AppData\Local\Temp\ipykernel_12220\469718015.py:29: FutureWarning: suggest_loguniform has been deprecated in v3.0.0. This feature will be removed in v6.0.0. See https://github.com/optuna/optuna/releases/tag/v3.0.0. Use suggest_float(..., log=True) instead.
  lr = trial.suggest_loguniform("lr", 1e-5, 1e-2)
[I 2025-02-23 18:11:52,715] Trial 4 finished with value: 0.7504058360766103 and parameters: {'optimizer': 'AdamW', 'lr': 8.140239291785144e-05, 'momentum': 0.620439680278104}. Best is trial 3 with value: 0.7706433474554033.
C:\Users\Астемир\AppData\Local\Temp\ipykernel_12220\469718015.py:29: FutureWarning: suggest_loguniform has been deprecated in v3.0.0. This feature will be removed in v6.0.0. See https://github.com/optuna/optuna/releases/tag/v3.0.0. Use suggest_float(..., log=True) instead.
  lr = trial.suggest_loguniform("lr", 1e-5, 1e-2)
[I 2025-02-23 18:11:53,508] Trial 5 finished with value: 0.7714559244828192 and parameters: {'optimizer': 'SGD', 'lr': 0.007552743204057893, 'momentum': 0.6643442626138835}. Best is trial 5 with value: 0.7714559244828192.
C:\Users\Астемир\AppData\Local\Temp\ipykernel_12220\469718015.py:29: FutureWarning: suggest_loguniform has been deprecated in v3.0.0. This feature will be removed in v6.0.0. See https://github.com/optuna/optuna/releases/tag/v3.0.0. Use suggest_float(..., log=True) instead.
  lr = trial.suggest_loguniform("lr", 1e-5, 1e-2)
[I 2025-02-23 18:11:54,468] Trial 6 finished with value: 0.7620416133544953 and parameters: {'optimizer': 'AdamW', 'lr': 6.345267138206725e-05, 'momentum': 0.7177867571620906}. Best is trial 5 with value: 0.7714559244828192.
C:\Users\Астемир\AppData\Local\Temp\ipykernel_12220\469718015.py:29: FutureWarning: suggest_loguniform has been deprecated in v3.0.0. This feature will be removed in v6.0.0. See https://github.com/optuna/optuna/releases/tag/v3.0.0. Use suggest_float(..., log=True) instead.
  lr = trial.suggest_loguniform("lr", 1e-5, 1e-2)
[I 2025-02-23 18:11:55,266] Trial 7 finished with value: 0.7740927278880416 and parameters: {'optimizer': 'SGD', 'lr': 0.001727562509593616, 'momentum': 0.5847907089931028}. Best is trial 7 with value: 0.7740927278880416.
C:\Users\Астемир\AppData\Local\Temp\ipykernel_12220\469718015.py:29: FutureWarning: suggest_loguniform has been deprecated in v3.0.0. This feature will be removed in v6.0.0. See https://github.com/optuna/optuna/releases/tag/v3.0.0. Use suggest_float(..., log=True) instead.
  lr = trial.suggest_loguniform("lr", 1e-5, 1e-2)
[I 2025-02-23 18:11:56,157] Trial 8 finished with value: 0.7628342831496137 and parameters: {'optimizer': 'AdamW', 'lr': 0.00014165671808905508, 'momentum': 0.6727883531756933}. Best is trial 7 with value: 0.7740927278880416.
C:\Users\Астемир\AppData\Local\Temp\ipykernel_12220\469718015.py:29: FutureWarning: suggest_loguniform has been deprecated in v3.0.0. This feature will be removed in v6.0.0. See https://github.com/optuna/optuna/releases/tag/v3.0.0. Use suggest_float(..., log=True) instead.
  lr = trial.suggest_loguniform("lr", 1e-5, 1e-2)
[I 2025-02-23 18:11:57,259] Trial 9 finished with value: 0.7710052971335396 and parameters: {'optimizer': 'AdamW', 'lr': 0.0038067778289038088, 'momentum': 0.9591773854080696}. Best is trial 7 with value: 0.7740927278880416.
C:\Users\Астемир\AppData\Local\Temp\ipykernel_12220\469718015.py:29: FutureWarning: suggest_loguniform has been deprecated in v3.0.0. This feature will be removed in v6.0.0. See https://github.com/optuna/optuna/releases/tag/v3.0.0. Use suggest_float(..., log=True) instead.
  lr = trial.suggest_loguniform("lr", 1e-5, 1e-2)
[I 2025-02-23 18:11:58,234] Trial 10 finished with value: 0.7601938602476098 and parameters: {'optimizer': 'SGD', 'lr': 0.0005918052584733902, 'momentum': 0.5192931481980705}. Best is trial 7 with value: 0.7740927278880416.
C:\Users\Астемир\AppData\Local\Temp\ipykernel_12220\469718015.py:29: FutureWarning: suggest_loguniform has been deprecated in v3.0.0. This feature will be removed in v6.0.0. See https://github.com/optuna/optuna/releases/tag/v3.0.0. Use suggest_float(..., log=True) instead.
  lr = trial.suggest_loguniform("lr", 1e-5, 1e-2)
[I 2025-02-23 18:11:59,278] Trial 11 finished with value: 0.7704135094097868 and parameters: {'optimizer': 'SGD', 'lr': 0.0019915151474880883, 'momentum': 0.8434719937134354}. Best is trial 7 with value: 0.7740927278880416.
C:\Users\Астемир\AppData\Local\Temp\ipykernel_12220\469718015.py:29: FutureWarning: suggest_loguniform has been deprecated in v3.0.0. This feature will be removed in v6.0.0. See https://github.com/optuna/optuna/releases/tag/v3.0.0. Use suggest_float(..., log=True) instead.
  lr = trial.suggest_loguniform("lr", 1e-5, 1e-2)
[I 2025-02-23 18:12:00,694] Trial 12 finished with value: 0.7727589433241097 and parameters: {'optimizer': 'SGD', 'lr': 0.009580470678423112, 'momentum': 0.5867429181056848}. Best is trial 7 with value: 0.7740927278880416.
C:\Users\Астемир\AppData\Local\Temp\ipykernel_12220\469718015.py:29: FutureWarning: suggest_loguniform has been deprecated in v3.0.0. This feature will be removed in v6.0.0. See https://github.com/optuna/optuna/releases/tag/v3.0.0. Use suggest_float(..., log=True) instead.
  lr = trial.suggest_loguniform("lr", 1e-5, 1e-2)
[I 2025-02-23 18:12:01,930] Trial 13 finished with value: 0.7579624404818998 and parameters: {'optimizer': 'SGD', 'lr': 0.0004494309924432044, 'momentum': 0.5817199120746374}. Best is trial 7 with value: 0.7740927278880416.
C:\Users\Астемир\AppData\Local\Temp\ipykernel_12220\469718015.py:29: FutureWarning: suggest_loguniform has been deprecated in v3.0.0. This feature will be removed in v6.0.0. See https://github.com/optuna/optuna/releases/tag/v3.0.0. Use suggest_float(..., log=True) instead.
  lr = trial.suggest_loguniform("lr", 1e-5, 1e-2)
[I 2025-02-23 18:12:02,997] Trial 14 finished with value: 0.5755180857205423 and parameters: {'optimizer': 'SGD', 'lr': 1.1289618542375061e-05, 'momentum': 0.5242134208726377}. Best is trial 7 with value: 0.7740927278880416.
C:\Users\Астемир\AppData\Local\Temp\ipykernel_12220\469718015.py:29: FutureWarning: suggest_loguniform has been deprecated in v3.0.0. This feature will be removed in v6.0.0. See https://github.com/optuna/optuna/releases/tag/v3.0.0. Use suggest_float(..., log=True) instead.
  lr = trial.suggest_loguniform("lr", 1e-5, 1e-2)
[I 2025-02-23 18:12:03,820] Trial 15 finished with value: 0.7697909559633923 and parameters: {'optimizer': 'SGD', 'lr': 0.0032215207393386097, 'momentum': 0.5933653472646498}. Best is trial 7 with value: 0.7740927278880416.
C:\Users\Астемир\AppData\Local\Temp\ipykernel_12220\469718015.py:29: FutureWarning: suggest_loguniform has been deprecated in v3.0.0. This feature will be removed in v6.0.0. See https://github.com/optuna/optuna/releases/tag/v3.0.0. Use suggest_float(..., log=True) instead.
  lr = trial.suggest_loguniform("lr", 1e-5, 1e-2)
[I 2025-02-23 18:12:04,730] Trial 16 finished with value: 0.7717129087542959 and parameters: {'optimizer': 'SGD', 'lr': 0.0011255648731714242, 'momentum': 0.8125765345911926}. Best is trial 7 with value: 0.7740927278880416.
C:\Users\Астемир\AppData\Local\Temp\ipykernel_12220\469718015.py:29: FutureWarning: suggest_loguniform has been deprecated in v3.0.0. This feature will be removed in v6.0.0. See https://github.com/optuna/optuna/releases/tag/v3.0.0. Use suggest_float(..., log=True) instead.
  lr = trial.suggest_loguniform("lr", 1e-5, 1e-2)
[I 2025-02-23 18:12:05,654] Trial 17 finished with value: 0.772961635143866 and parameters: {'optimizer': 'SGD', 'lr': 0.0049337332240186925, 'momentum': 0.6165101323861306}. Best is trial 7 with value: 0.7740927278880416.
C:\Users\Астемир\AppData\Local\Temp\ipykernel_12220\469718015.py:29: FutureWarning: suggest_loguniform has been deprecated in v3.0.0. This feature will be removed in v6.0.0. See https://github.com/optuna/optuna/releases/tag/v3.0.0. Use suggest_float(..., log=True) instead.
  lr = trial.suggest_loguniform("lr", 1e-5, 1e-2)
[I 2025-02-23 18:12:06,502] Trial 18 finished with value: 0.7313663781324483 and parameters: {'optimizer': 'SGD', 'lr': 0.00021361603225873485, 'momentum': 0.6321943494733463}. Best is trial 7 with value: 0.7740927278880416.
C:\Users\Астемир\AppData\Local\Temp\ipykernel_12220\469718015.py:29: FutureWarning: suggest_loguniform has been deprecated in v3.0.0. This feature will be removed in v6.0.0. See https://github.com/optuna/optuna/releases/tag/v3.0.0. Use suggest_float(..., log=True) instead.
  lr = trial.suggest_loguniform("lr", 1e-5, 1e-2)
[I 2025-02-23 18:12:07,299] Trial 19 finished with value: 0.7720621901936974 and parameters: {'optimizer': 'SGD', 'lr': 0.003925289101052881, 'momentum': 0.5046023335811459}. Best is trial 7 with value: 0.7740927278880416.
Лучшие параметры для df4_iid: {'optimizer': 'SGD', 'lr': 0.001727562509593616, 'momentum': 0.5847907089931028}
